{
  "$schema": "https://json-schema.org/draft-07/schema",
  "properties": {
    "filter": {
      "type": "object",
      "order": 0,
      "description": "The filter used for frosted glassed effect. Check README for detailed description.",
      "patternProperties": {
        ".*": {
          "type": [
            "string",
            "object"
          ],
          "properties": {
            "filter": {
              "type": "string"
            },
            "disableBackgroundColor": {
              "type": "boolean"
            },
            "opacity": {
              "type": "number"
            },
            "customAttrs": {
              "type": [
                "object",
                "null"
              ],
              "description": "Custom attributes to be applied to tint svgs. Key is css selector, value is a map of attributes.",
              "patternProperties": {
                ".*": {
                  "type": "object"
                }
              }
            },
            "acrylicBlur": {
              "type": "number",
              "description": "Inject runtime: feGaussianBlur stdDeviation for this surface's acrylic SVG (set from cursor.additional.style *Blur on Apply Config)."
            }
          }
        }
      }
    },
    "transition": {
      "type": "string",
      "order": 1,
      "description": "CSS transition."
    },
    "svg": {
      "type": "array",
      "order": 2,
      "description": "The svgs that load on start. No tint (ie. no element current background info).",
      "items": {
        "type": "string"
      }
    },
    "tintSvg": {
      "type": "array",
      "order": 3,
      "markdownDescription": "The tint svgs that load on start. `--fgt-current-background` indicates current element solid background color and `--fgt-current-opacity` indicates current opacity.",
      "items": {
        "type": "string"
      }
    },
    "variable": {
      "type": "object",
      "order": 4,
      "description": "CSS variable. You may use them in settings and svgs.",
      "patternProperties": {
        ".*": {
          "type": "string"
        }
      }
    },
    "variableDark": {
      "type": "object",
      "order": 5,
      "description": "CSS variable in dark mode. You may use them in settings and svgs.",
      "patternProperties": {
        ".*": {
          "type": "string"
        }
      }
    },
    "additionalStyle": {
      "type": "array",
      "order": 6,
      "description": "Additional style paths. They will be appended to <head>. You can add custom animations or styles.",
      "items": {
        "type": "string"
      }
    },
    "opacity": {
      "type": "object",
      "properties": {
        "selection": {
          "type": "number",
          "description": "Menu selection opacity. This will blend into your theme color."
        },
        "border": {
          "type": "number",
          "description": "Border opacity. This will blend into your theme color."
        },
        "separator": {
          "type": "number",
          "description": "Menu separator opacity. This will blend into your theme color."
        },
        "minimap": {
          "type": "number",
          "description": "Minimap opacity."
        }
      }
    },
    "animation": {
      "type": "object",
      "description": "CSS animation. Key can also be css selector.",
      "patternProperties": {
        ".*": {
          "type": "string"
        }
      }
    },
    "effect": {
      "type": "object",
      "properties": {
        "revealEffect": {
          "type": "object",
          "description": "Reveal effect config.",
          "properties": {
            "lightColor": {
              "type": "string"
            },
            "gradientSize": {
              "type": [
                "number",
                "string"
              ],
              "description": "A number in px or a string type percentage ends with %."
            },
            "clickEffect": {
              "type": [
                "object",
                "null"
              ],
              "properties": {
                "size": {
                  "type": [
                    "number",
                    "string"
                  ],
                  "description": "A number in px or a string type percentage ends with %."
                },
                "speed": {
                  "type": "number"
                },
                "duration": {
                  "type": "number"
                }
              }
            }
          }
        },
        "flipEffect": {
          "type": "object",
          "description": "Flip effect config.",
          "properties": {
            "reducedDistanceFunc": {
              "type": "string",
              "description": "A function used to calculate reduced distance in px."
            },
            "transition": {
              "type": "string"
            },
            "perspective": {
              "type": "number",
              "description": "Perspective in cm."
            }
          }
        },
        "extendMenuFocusBackground": {
          "type": [
            "boolean",
            "string"
          ],
          "description": "Extend menu focus background. Set to false to use vanilla round corner style. Can also be set to color string as a new background color."
        },
        "disableForDisabledItem": {
          "type": "boolean",
          "description": "Disable effect for disabled menu item."
        }
      }
    },
    "borderRadius": {
      "type": "object",
      "description": "Border radius (with unit). Key can also be css selector.",
      "patternProperties": {
        ".*": {
          "type": "string"
        }
      }
    },
    "fakeMica": {
      "type": "object",
      "properties": {
        "enabled": {
          "type": "boolean",
          "description": "Enable fake mica.",
          "order": 0
        },
        "url": {
          "type": "string",
          "markdownDescription": "Url to wallpaper. Default to windows default wallpaper. For spotlight, you can use `C:/Users/<username>/AppData/Roaming/Microsoft/Windows/Themes/CachedFiles/<Something>.jpg`.",
          "order": 1
        },
        "filter": {
          "type": "string",
          "description": "The filter used for background.",
          "order": 2
        },
        "moveWithWindow": {
          "type": "boolean",
          "description": "The mica effect will move with window, creating a parallax effect.",
          "order": 3
        },
        "titlebarFix": {
          "type": [
            "number",
            "null"
          ],
          "description": "Fix titlebar opacity."
        },
        "editorBackgroundFix": {
          "type": "boolean",
          "markdownDescription": "Fix editor overlapping background. Leave `editor-container` as the final color."
        }
      }
    },
    "miscellaneous": {
      "type": "object",
      "properties": {
        "progressBarBehindSectionHeader": {
          "type": "boolean",
          "description": "Put progressBar behind sectionHeader so it glows behind header blur."
        },
        "disableFocusOutline": {
          "type": "boolean",
          "description": "Remove outline from focused elements."
        }
      }
    },
    "cursorAdditionalStyle": {
      "type": "object",
      "description": "Cursor only. Editable acrylic blur for menubar menus, quick input, notifications, and find bar (Apply Config wires filter.*).",
      "properties": {
        "generalMenuBlur": {
          "type": "string",
          "description": "Acrylic blur for filter.menu: menubar dropdowns and editor/sidebar context menus (e.g. 12px). Color: menu.background."
        },
        "quickInputBlur": {
          "type": "string",
          "description": "Acrylic blur on command palette, file search, and remote window picker via filter.quickInput (e.g. 12px). Color: quickInput.background."
        },
        "notificationsBlur": {
          "type": "string",
          "description": "Acrylic blur for notification toasts, notification center, and list via filter.notifications and filter.notificationToast (e.g. 12px). Color: notifications.background."
        },
        "wordSearchBarBlur": {
          "type": "string",
          "description": "Acrylic blur on the editor find bar (Ctrl+F) via filter.listFilterWidget (e.g. 12px). Not a workbench.colorCustomizations key."
        }
      }
    },
    "cursor": {
      "type": "object",
      "description": "Cursor only. Panel backgrounds (#RRGGBBAA hex) and backdrop blur for agent chat surfaces.",
      "properties": {
        "chatPaneBackground": {
          "type": "string",
          "description": "Chat / composer panel background."
        },
        "agentSidePanelBackground": {
          "type": "string",
          "description": "Agent side panel background."
        },
        "sidebarIconBarBackground": {
          "type": "string",
          "description": "Sidebar icon bar background."
        },
        "sentMessageBubbleBackground": {
          "type": "string",
          "description": "Background on past sent user message bubbles (#RRGGBBAA hex). Composer input uses input.background."
        },
        "sentMessageBubbleBlur": {
          "type": "string",
          "description": "Backdrop blur on past sent user message bubbles (e.g. 8px)."
        },
        "slashMenuBlur": {
          "type": "string",
          "description": "Backdrop blur on the / slash command menu (e.g. 12px). Color and opacity use workbench.colorCustomizations dropdown.background (save)."
        },
        "mentionMenuBlur": {
          "type": "string",
          "description": "Backdrop blur on the @ mention menu and its side preview flyout (e.g. 12px). Color and opacity use workbench.colorCustomizations dropdown.background (save)."
        },
        "composerModeMenuBlur": {
          "type": "string",
          "description": "Deprecated. Use modePickerMenuBlur."
        },
        "modePickerMenuBlur": {
          "type": "string",
          "description": "Backdrop blur on the composer agent/mode picker popup (Agent, Plan, Debug, …). Color uses dropdown.background."
        },
        "modelPickerMenuBlur": {
          "type": "string",
          "description": "Backdrop blur on the composer model picker popup (e.g. 12px). Color uses dropdown.background."
        },
        "chatContextMenuBlur": {
          "type": "string",
          "description": "Deprecated. Use extraCursorMenusBlur."
        },
        "chatRightClickMenuBlur": {
          "type": "string",
          "description": "Deprecated. Use extraCursorMenusBlur."
        },
        "extraCursorMenusBlur": {
          "type": "string",
          "description": "Cursor only. Shared backdrop blur for agent chat right-click menus, agent side panel right-click, sidebar icon bar dropdown, and code-changes chat preview boxes. Color: menu.background."
        }
      }
    }
  }
}